{
  "contract_version": "1.0",
  "created_at": "2026-09-19T16:53:41+00:00",
  "finalized_at": "2026-09-19T23:05:16+00:00",
  "finished_at": "2026-09-19T23:03:11+00:00",
  "generation_attempt": 5,
  "generator_exit_code": 0,
  "invocation": [
    "codex",
    "exec",
    "--cd",
    "runs/v2-o6_16-terra-20260919/workspace",
    "--model",
    "gpt-5.6-terra",
    "--sandbox",
    "workspace-write",
    "--ephemeral",
    "--ignore-user-config",
    "--json",
    "--output-last-message",
    "runs/v2-o6_16-terra-20260919/raw/final-message.md",
    "-c",
    "model_reasoning_effort=\"high\"",
    "-"
  ],
  "measure": "o6_16",
  "metrics": {
    "conform_profile_unchanged": false,
    "contract_errors": {
      "coverage": [],
      "coverage_scope": [],
      "cross_references": [],
      "data": [],
      "data_inventory": [],
      "evidence": [],
      "profile_application": [],
      "profile_changes": [],
      "rules_catalog": [],
      "source_references": []
    },
    "coverage_item_count": 40,
    "data_bytes": 210643,
    "data_files": 1,
    "data_table_count": 4,
    "generated_test_count": 9,
    "grounding_valid": true,
    "input_paths": 21,
    "inventory_created": true,
    "profile_change_proposal_count": 1,
    "profile_paths_added": 94,
    "profile_paths_changed": 0,
    "profile_paths_removed": 0,
    "rego_files": 2,
    "rego_lines": 375,
    "required_outputs_missing": [],
    "source_reference_count": 30,
    "structured_rule_count": 34,
    "technical_validation_exit_code": 0,
    "unknown_input_paths": 0,
    "working_profile_unchanged": true
  },
  "mode": "discover",
  "model": {
    "adapter": "codex-cli",
    "api_style": "codex_cli",
    "args": [],
    "contract_version": "model-config-v1.0.0",
    "executable": "codex",
    "model": "gpt-5.6-terra",
    "provider": "openai",
    "reasoning_effort": "high",
    "timeout_seconds": 3600
  },
  "profile": {
    "path": "profiles/canonical_farm_profile.json",
    "sha256": "768688efd4ef3fd21bf7007d40532dfde77f0699401373371f2dfae75f848792"
  },
  "run_id": "v2-o6_16-terra-20260919",
  "sources": [
    {
      "bytes": 2112561,
      "name": "20241011_srl_oepul_2023.pdf",
      "sha256": "b9b8daabcde20d6dd3dfa58987aee5c481d8993fe4b6c752fe778bc9468d4798",
      "source_path": "legal/20241011_srl_oepul_2023.pdf"
    },
    {
      "bytes": 4459467,
      "name": "20241011_srl_oepul_2023_anhaenge.pdf",
      "sha256": "1f608a5a43f1f93df5f8fd542233b37d312d11fd5d0fa5164d3bd8d4b60a119a",
      "source_path": "legal/20241011_srl_oepul_2023_anhaenge.pdf"
    },
    {
      "bytes": 34757,
      "name": "2026-05-22__trockenheitsbedingte-ausnahmeregelungen-fuer-oepul-biodiversitaetsflaechen.html",
      "sha256": "337f679255d85af31a4d55039b448420158e0647fd3f279153c0d67f4ec3e4b8",
      "source_path": "notices/2026/2026-05-22__trockenheitsbedingte-ausnahmeregelungen-fuer-oepul-biodiversitaetsflaechen.html"
    },
    {
      "bytes": 27896,
      "name": "2026-06-12__vorzeitiger-ausstieg-aus-der-oepul-massnahme-insektizidverzicht-wein-obst-und-hopfen-fuer-weinbaubetriebe-aufgrund-des-befallsdrucks-durch-die-amerikanische-rebzikade-moeglich.html",
      "sha256": "be5ae0458262511e840119e8e654f2b1331f510da87fe97506e38d49cb19bed4",
      "source_path": "notices/2026/2026-06-12__vorzeitiger-ausstieg-aus-der-oepul-massnahme-insektizidverzicht-wein-obst-und-hopfen-fuer-weinbaubetriebe-aufgrund-des-befallsdrucks-durch-die-amerikanische-rebzikade-moeglich.html"
    },
    {
      "bytes": 29357,
      "name": "2026-08-05__duerre-2026-erleichterungen-bei-oepul-und-bei-der-ausgleichszulage.html",
      "sha256": "6766adb41b9ae176b9aafb1db390f67bd25cbfcc9ce249012bbfc0d7b60acca4",
      "source_path": "notices/2026/2026-08-05__duerre-2026-erleichterungen-bei-oepul-und-bei-der-ausgleichszulage.html"
    },
    {
      "bytes": 29067,
      "name": "2026-08-12__duerre-2026-erleichterungen-in-der-oepul-foerderungsabwicklung.html",
      "sha256": "661072233da37d1ac62aba860e36173e83c98c85119bc6170c0a27dd7d7e435c",
      "source_path": "notices/2026/2026-08-12__duerre-2026-erleichterungen-in-der-oepul-foerderungsabwicklung.html"
    },
    {
      "bytes": 428617,
      "name": "o6_16_vorbeugender_grundwasserschutz_acker_2026_04.pdf",
      "sha256": "c23af2c778b023db57103318d3d81351d317409fad536e7b098adab5afa925c0",
      "source_path": "originals/o6_16_vorbeugender_grundwasserschutz_acker_2026_04.pdf"
    },
    {
      "bytes": 416598,
      "name": "o6_allgemeine_teilnahmebedingungen_2026_04.pdf",
      "sha256": "89ad678a94ad109f6ba92563be4650dd0d36a6f3599506a187b56b1398dca120",
      "source_path": "originals/o6_allgemeine_teilnahmebedingungen_2026_04.pdf"
    }
  ],
  "started_at": "2026-09-19T23:02:13+00:00",
  "status": "finalized"
}
